Sheet: Feuille1
A1: Nb membres | B1: 7
A2: semaines restantes | B2: 8
A3: Nb heure/sem/personne | B3: 40
A4: Nb Heure homme du projet | B4: of:=[.B1]*[.B2]*[.B3]+100 -> 2340
B6: Pourcentage | C6: Heure homme
A7: NIVEAU 0
A8: Etude préalable | B8: 0.05 | C8: of:=h_tot*[.B8] -> 117
A9: Etude détaillée | B9: of:=(43)% -> 0.43 | C9: of:=h_tot*[.B9] -> 1006.2
A10: Front-end | B10: of:=14.5% -> 0.145 | C10: of:=h_tot*[.B10] -> 339.3
A11: Back-end | B11: of:=[.B10] -> 0.145 | C11: of:=h_tot*[.B11] -> 339.3
A12: Integration | B12: of:=13% -> 0.13 | C12: of:=h_tot*[.B12] -> 304.2
A13: Total projet | B13: of:=[.B9]+[.B10]+[.B11]+[.B12]+[.B8] -> 0.9 | C13: of:=h_tot*[.B13] -> 2106
A14: Rédaction CR | B14: 0.1 | C14: of:=h_tot*[.B14] -> 234
A15: NIVEAU 1 : Etude détaillée
A16: Schéma prévisionnel | B16: 0.175 | C16: of:=[.C9]*[.B16] -> 176.085
A17: Cahier des charges | B17: 0.175 | C17: of:=[.C9]*[.B17] -> 176.085
A18: Maquette graphique | B18: 0.05 | C18: of:=[.C9]*[.B18] -> 50.31
A19: Diagramme UML | B19: 0.5 | C19: of:=[.C9]*[.B19] -> 503.1
A20: Création de la documentation | B20: 0.1 | C20: of:=[.C9]*[.B20] -> 100.62
A21: NIVEAU 1 : Front-end
A22: Création de l’interface utilisateur | B22: 0.9 | C22: of:=[.C10]*[.B22] -> 305.37
A23: Test et debogage Front-end | B23: 0.1 | C23: of:=[.C10]*[.B23] -> 33.93
A24: NIVEAU 1 : Back-end
A25: Développement de l’algorithme de simulation | B25: 0.7 | C25: of:=[.C11]*[.B25] -> 237.51
A26: Développement de l’API | B26: 0.2 | C26: of:=[.C11]*[.B26] -> 67.86
A27: Test et debogage Back-end | B27: 0.1 | C27: of:=[.C11]*[.B27] -> 33.93
A28: NIVEAU 2 : Schéma prévisionnel
A29: Tableau des préférences | B29: 0.05 | C29: of:=[.C16]*[.B29] -> 8.80425
A30: Diagramme WBS | B30: 0.75 | C30: of:=[.C16]*[.B30] -> 132.06375
A31: Diagramme GANTT | B31: 0.2 | C31: of:=[.C16]*[.B31] -> 35.217
A32: NIVEAU 2 : Diagrammes UML
A33: Etude préalable | B33: 0.5 | C33: of:=[.C19]*[.B33] -> 251.55
A34: UML Front-end | B34: 0.25 | C34: of:=[.C19]*[.B34] -> 125.775
A35: UML Back-end | B35: 0.25 | C35: of:=[.C19]*[.B35] -> 125.775
A36: NIVEAU 2 : Création de l’interface utilisateur
A37: Interface données d’entrée | B37: 0.25 | C37: of:=[.C22]*[.B37] -> 76.3425
A38: Traduction Anglais/Français | B38: 0.05 | C38: of:=[.C22]*[.B38] -> 15.2685
A39: Ajout de la documentation | B39: 0.01 | C39: of:=[.C22]*[.B39] -> 3.0537
A40: Module de cartographie | B40: 0.23 | C40: of:=[.C22]*[.B40] -> 70.2351
A41: Module du spectre d’absorption | B41: 0.23 | C41: of:=[.C22]*[.B41] -> 70.2351
A42: Module d’affichage de l’intensité | B42: 0.23 | C42: of:=[.C22]*[.B42] -> 70.2351
A43: NIVEAU 2 : Développement de l’algorithme de simulation
A44: Conception de l’algorithme | B44: 0.9 | C44: of:=[.C25]*[.B44] -> 213.759
A45: Implémentation de l’algorithme | B45: 0.1 | C45: of:=[.C25]*[.B45] -> 23.751
A46: NIVEAU 2 : Développement de l’API
A47: Conception de l’API | B47: 0.9 | C47: of:=[.C26]*[.B47] -> 61.074
A48: Implémentation de l’API | B48: 0.1 | C48: of:=[.C26]*[.B48] -> 6.786